{
  "schema": "wphx.ownership-manifest.v1",
  "manifest_id": "ownership:wp-core/wpdb-dbdelta-candidate",
  "issue": {
    "id": "wordpresshx-l76.9.10",
    "external_ref": "WPHX-305.10"
  },
  "unit": {
    "kind": "module",
    "name": "wpdb dbDelta live database Haxe candidate",
    "area": "wp-includes/wp-admin",
    "public_contract": "WordPress-compatible maybe_create_table(), maybe_add_column(), and dbDelta() global PHP functions remain callable from wp-admin/includes/upgrade.php while selected schema-helper and dbDelta planning decisions delegate to typed Haxe and continue to execute against locked live MySQL and MariaDB runtimes through wpdb."
  },
  "ownership_state": "haxe_parity_candidate",
  "upstream": {
    "repo": "../wordpress-develop",
    "ref": "26b68024931348d267b70e2a29910e1320d0094f",
    "paths": [
      "src/wp-includes/class-wp-hook.php",
      "src/wp-includes/compat.php",
      "src/wp-includes/utf8.php",
      "src/wp-includes/load.php",
      "src/wp-includes/plugin.php",
      "src/wp-includes/class-wp-error.php",
      "src/wp-includes/class-wpdb.php",
      "src/wp-includes/cache.php",
      "src/wp-includes/class-wp-object-cache.php",
      "src/wp-includes/functions.php",
      "src/wp-includes/kses.php",
      "src/wp-includes/formatting.php",
      "src/wp-includes/option.php",
      "src/wp-admin/includes/schema.php",
      "src/wp-admin/includes/upgrade.php"
    ],
    "digest": "sha256:3d637e4ff944dd8783efc2042c0252d18844288936712ec923381843c101255b"
  },
  "owned_paths": [
    "fixtures/wp-core/wpdb-dbdelta-candidate.hxml",
    "src/wphx/wp/db/LiveDbSchema.hx",
    "src/wphx/wp/db/DbDeltaPlanner.hx",
    "fixtures/wp-core/src/wphx/fixtures/wp/core/WpdbDbDeltaCandidateEntry.hx",
    "tools/wp-core/run-wpdb-dbdelta-candidate.mjs",
    "manifests/wp-core/wphx-305-10-wpdb-dbdelta-candidate.v1.json",
    "receipts/wp-core/wphx-305-10-wpdb-dbdelta-candidate.v1.json"
  ],
  "generated_paths": [
    "build/wp-core/wphx-305-10",
    "manifests/wp-core/wphx-305-10-wpdb-dbdelta-candidate.v1.json",
    "manifests/ownership/wphx-305-10-wpdb-dbdelta-candidate.v1.json",
    "receipts/wp-core/wphx-305-10-wpdb-dbdelta-candidate.v1.json"
  ],
  "bridge": {
    "kind": "generated_shell",
    "reason": "WordPress core and plugins call global PHP upgrade helpers with native wpdb state. The candidate keeps the public PHP function shell and delegates normalized table/column existence, dbDelta query classification, field/index-line classification, and index type/name normalization decisions to Haxe.",
    "bounded_by": [
      "generated candidate wp-admin/includes/upgrade.php shell",
      "WPHX-305.10 live MySQL/MariaDB oracle comparison receipt",
      "native wpdb query/get_var/get_col boundary for real database execution"
    ]
  },
  "removal_gate": {
    "condition": "Promote from generated shell candidate to verified owned distribution only after broader wpdb/schema distribution work proves include timing, reflection, mixed PHP ABI, and plugin compatibility for upgrade.php.",
    "owner_issue": "WPHX-305",
    "target_state": "verified_haxe_owned"
  },
  "smell_fixes": [
    {
      "description": "Separated maybe_create_table()/maybe_add_column() branch decisions plus bounded dbDelta query/line/index classification decisions from native SQL execution into typed Haxe helpers, making the decision surface explicit without changing observable WordPress behavior.",
      "compatibility_evidence": [
        "schema:maybe-create-table",
        "schema:maybe-add-column",
        "schema:dbdelta-plan-no-execute",
        "schema:dbdelta-execute-and-dml"
      ],
      "behavior_policy": "no_observable_change"
    }
  ],
  "verification": {
    "oracle_commands": [
      "npm run wp:core:wphx-305-dbdelta-candidate",
      "npm run wp:core:wphx-305-dbdelta-candidate:check",
      "npm run wp:core:wphx-305-live-db-candidate:check",
      "npm run wp:core:wphx-305-live-db:check",
      "npm run haxe:escape-hatches:check",
      "npm run beads:validate",
      "npm run receipts:validate"
    ],
    "receipt_refs": [
      "receipt:wphx-305-10-wpdb-dbdelta-candidate",
      "receipt:wphx-305-08-wpdb-live-db-candidate",
      "receipt:wphx-305-07-wpdb-live-db-runtime-gate"
    ],
    "manifest_digest": "sha256:ed12df04aacc5e5ced10d9376b1c3c291f6b2c7f97b5c7bbb607a55d90683b54"
  },
  "notes": "The candidate provisions mysql-8.4 and mariadb-11.8 containers from locked index digests and runs the WPHX-305.07 live DB cases with local PHP mysqli. The broad wp-admin include remains stubbed because this workset is scoped to database helpers, dbDelta planning decisions, and storage paths."
}
