{
  "schema": "wphx.ownership-manifest.v1",
  "manifest_id": "ownership:wp/hooks-workset",
  "issue": {
    "id": "wordpresshx-l76.2",
    "external_ref": "WPHX-302"
  },
  "unit": {
    "kind": "workset",
    "name": "hooks/plugin-api",
    "area": "wp-includes",
    "public_contract": "plugin.php and class-wp-hook.php hook/plugin API surface plus fixture plugin behavior"
  },
  "ownership_state": "verified_haxe_owned",
  "upstream": {
    "repo": "../wordpress-develop",
    "ref": "26b68024931348d267b70e2a29910e1320d0094f",
    "paths": [
      "src/wp-includes/plugin.php",
      "src/wp-includes/class-wp-hook.php"
    ],
    "digest": "sha256:f40915601db31966c3fad5c84cb33449f827d613ca996723b08fd783d1c21358"
  },
  "owned_paths": [
    "fixtures/php-facade/src/wphx/fixtures/php/facade/HookEntry.hx",
    "fixtures/php-facade/src/wphx/fixtures/php/facade/HookKernel.hx",
    "fixtures/php-facade/f7-hook-kernel.hxml",
    "tools/php-facade/run-f7-hook-kernel.mjs",
    "tools/wp-hooks/run-hook-surface.mjs"
  ],
  "generated_paths": [
    "build/php-hook-kernel",
    "build/wp-hooks/hook-surface-probe.php",
    "build/wp-hooks/expected-hook-surface.json"
  ],
  "verification": {
    "oracle_commands": [
      "npm run php:facade:f7",
      "npm run wp:hooks:surface",
      "npm run wp:hooks:surface:check",
      "npm run wp:hooks:distribution-surface:check"
    ],
    "receipt_refs": [
      "receipt:wphx-302-hook-surface",
      "receipt:wphx-302-04-hook-distribution-surface"
    ],
    "manifest_digest": "sha256:05daa2fdca2693c7157911333b0d2a4f9030d6c2986e6c7c36f780ce4b881842"
  },
  "notes": "WPHX-302 records complete API surface coverage and fixture plugin parity for the hook workset. WPHX-302.04 promotes the surface to verified Haxe-owned distribution output with approved PHP-native public ABI boundaries."
}
