{
  "schema": "wphx.ownership-manifest.v1",
  "manifest_id": "ownership:wp-core/rest-settings-dispatch-fixture",
  "issue": {
    "id": "wordpresshx-l76.10.2",
    "external_ref": "WPHX-311.02"
  },
  "unit": {
    "kind": "workset",
    "name": "REST settings server-dispatch differential fixture harness",
    "area": "wp-includes/rest-api.php wp-includes/rest-api/class-wp-rest-server.php wp-includes/rest-api/endpoints/class-wp-rest-settings-controller.php",
    "public_contract": "The /wp/v2/settings endpoint must preserve WordPress REST server dispatch behavior: route matching, request validation/sanitization, permission failures, filter short-circuits, response wrapping, error conversion, and matched route/handler metadata."
  },
  "ownership_state": "external_oracle",
  "upstream": {
    "repo": "../wordpress-develop",
    "ref": "26b68024931348d267b70e2a29910e1320d0094f",
    "paths": [
      "src/wp-includes/class-wp-hook.php",
      "src/wp-includes/plugin.php",
      "src/wp-includes/compat.php",
      "src/wp-includes/utf8.php",
      "src/wp-includes/load.php",
      "src/wp-includes/pomo/plural-forms.php",
      "src/wp-includes/pomo/entry.php",
      "src/wp-includes/pomo/translations.php",
      "src/wp-includes/l10n.php",
      "src/wp-includes/class-wp-list-util.php",
      "src/wp-includes/class-wp-error.php",
      "src/wp-includes/class-wp-http-response.php",
      "src/wp-includes/functions.php",
      "src/wp-includes/cache.php",
      "src/wp-includes/class-wp-object-cache.php",
      "src/wp-includes/formatting.php",
      "src/wp-includes/option.php",
      "src/wp-includes/rest-api.php",
      "src/wp-includes/rest-api/class-wp-rest-request.php",
      "src/wp-includes/rest-api/class-wp-rest-response.php",
      "src/wp-includes/rest-api/class-wp-rest-server.php",
      "src/wp-includes/rest-api/endpoints/class-wp-rest-controller.php",
      "src/wp-includes/rest-api/endpoints/class-wp-rest-settings-controller.php"
    ],
    "digest": "sha256:fa9e8eab91c03099ffef9abc64496bee6de6cd3002777ea24ad23ccbbfcbc277"
  },
  "owned_paths": [
    "tools/wp-core/run-rest-settings-dispatch-fixture.mjs",
    "manifests/wp-core/wphx-311-02-rest-settings-dispatch-fixture.v1.json",
    "manifests/ownership/wphx-311-02-rest-settings-dispatch-fixture.v1.json",
    "receipts/wp-core/wphx-311-02-rest-settings-dispatch-fixture.v1.json"
  ],
  "generated_paths": [
    "manifests/wp-core/wphx-311-02-rest-settings-dispatch-fixture.v1.json",
    "manifests/ownership/wphx-311-02-rest-settings-dispatch-fixture.v1.json",
    "receipts/wp-core/wphx-311-02-rest-settings-dispatch-fixture.v1.json",
    "build/wp-core/wphx-311-02"
  ],
  "verification": {
    "oracle_commands": [
      "npm run wp:core:wphx-311-rest-settings-dispatch",
      "npm run wp:core:wphx-311-rest-settings-dispatch:check",
      "npm run wp:core:wphx-311-rest-settings-controller:check",
      "npm run beads:validate",
      "npm run receipts:validate"
    ],
    "receipt_refs": [
      "receipt:wphx-311-02-rest-settings-dispatch-fixture",
      "receipt:wphx-311-01-rest-settings-controller-fixture"
    ],
    "manifest_digest": "sha256:186c341ecc03066b74cd244cbeb5729593e62ff5bcd6864498889e6fee97ab8b"
  },
  "notes": "This fixture proves REST server dispatch over the settings route with deterministic auth and wpdb/cache boundaries. It is not yet a typed Haxe REST implementation or an HTTP serving fixture."
}
